{
  "schema_version": 2,
  "id": "production-evaluation-foundation",
  "status": "implementation",
  "contracts": [
    {
      "id": "foundation",
      "kind": "schema",
      "path": "evaluation/schema/foundation.schema.json",
      "owner": "evaluation",
      "producer": "foundation-loader",
      "consumer": "qualification",
      "absence_status": "invalid"
    },
    {
      "id": "manifest",
      "kind": "schema",
      "path": "evaluation/schema/manifest.schema.json",
      "owner": "evaluation",
      "producer": "spec-loader",
      "consumer": "runner",
      "absence_status": "invalid"
    },
    {
      "id": "scenario",
      "kind": "schema",
      "path": "evaluation/schema/scenario.schema.json",
      "owner": "evaluation",
      "producer": "spec-loader",
      "consumer": "runner",
      "absence_status": "invalid"
    },
    {
      "id": "run-evidence",
      "kind": "schema",
      "path": "evaluation/schema/run-evidence.schema.json",
      "owner": "evaluation",
      "producer": "runner",
      "consumer": "oracle",
      "absence_status": "invalid"
    },
    {
      "id": "oracle-input",
      "kind": "schema",
      "path": "evaluation/schema/oracle-input.schema.json",
      "owner": "evaluation",
      "producer": "evidence-adapter",
      "consumer": "oracle",
      "absence_status": "invalid"
    },
    {
      "id": "oracle-contract",
      "kind": "schema",
      "path": "evaluation/schema/oracle-contract.schema.json",
      "owner": "evaluation",
      "producer": "foundation-loader",
      "consumer": "oracle",
      "absence_status": "invalid"
    },
    {
      "id": "mutation-contract",
      "kind": "schema",
      "path": "evaluation/schema/mutation-contract.schema.json",
      "owner": "evaluation",
      "producer": "foundation-loader",
      "consumer": "replay",
      "absence_status": "invalid"
    },
    {
      "id": "core-pack",
      "kind": "schema",
      "path": "evaluation/schema/core-pack.schema.json",
      "owner": "evaluation",
      "producer": "corepack-loader",
      "consumer": "qualification",
      "absence_status": "invalid"
    },
    {
      "id": "d1-execution",
      "kind": "schema",
      "path": "evaluation/schema/d1-execution.schema.json",
      "owner": "evaluation",
      "producer": "discovery-loader",
      "consumer": "discovery-coordinator",
      "absence_status": "invalid"
    },
    {
      "id": "h1-execution",
      "kind": "schema",
      "path": "evaluation/schema/h1-execution.schema.json",
      "owner": "evaluation",
      "producer": "admission-loader",
      "consumer": "admission-coordinator",
      "absence_status": "invalid"
    },
    {
      "id": "h2-execution",
      "kind": "schema",
      "path": "evaluation/schema/h2-execution.schema.json",
      "owner": "evaluation",
      "producer": "admission-loader",
      "consumer": "admission-coordinator",
      "absence_status": "invalid"
    },
    {
      "id": "h3-execution",
      "kind": "schema",
      "path": "evaluation/schema/h3-execution.schema.json",
      "owner": "evaluation",
      "producer": "admission-loader",
      "consumer": "admission-coordinator",
      "absence_status": "invalid"
    },
    {
      "id": "impact-policy",
      "kind": "schema",
      "path": "evaluation/schema/impact-map.schema.json",
      "owner": "evaluation",
      "producer": "impact-selector",
      "consumer": "qualification",
      "absence_status": "invalid"
    },
    {
      "id": "promotion-review",
      "kind": "schema",
      "path": "evaluation/schema/promotion-review.schema.json",
      "owner": "evaluation",
      "producer": "privacy-reviewer",
      "consumer": "corpus-promoter",
      "absence_status": "invalid"
    },
    {
      "id": "corpus-batch",
      "kind": "schema",
      "path": "evaluation/schema/corpus-batch.schema.json",
      "owner": "evaluation",
      "producer": "corpus-promoter",
      "consumer": "corpus-verifier",
      "absence_status": "invalid"
    },
    {
      "id": "qualified-corpus",
      "kind": "schema",
      "path": "evaluation/schema/qualified-corpus-manifest.schema.json",
      "owner": "evaluation",
      "producer": "corpus-promoter",
      "consumer": "replay",
      "absence_status": "invalid"
    },
    {
      "id": "harness-lock",
      "kind": "schema",
      "path": "evaluation/schema/harness-lock.schema.json",
      "owner": "evaluation",
      "producer": "freeze",
      "consumer": "qualification",
      "absence_status": "invalid"
    },
    {
      "id": "qualification",
      "kind": "schema",
      "path": "evaluation/schema/qualification.schema.json",
      "owner": "evaluation",
      "producer": "qualification",
      "consumer": "global-assessment",
      "absence_status": "invalid"
    },
    {
      "id": "release-evidence",
      "kind": "schema",
      "path": "evaluation/schema/release-evidence.schema.json",
      "owner": "evaluation",
      "producer": "release-admission",
      "consumer": "release",
      "absence_status": "invalid"
    }
  ],
  "oracle_catalog": "evaluation/spec/oracle-contracts.json",
  "mutation_catalog": "evaluation/spec/mutation-contracts.json",
  "core_pack": "evaluation/scenarios/core/pack.json",
  "impact_policy": "evaluation/impact-map.json",
  "implementation_roots": [
    "evaluation/cmd",
    "evaluation/internal"
  ]
}
